﻿graduate_school,壓力,/f/graduate_school/p/239477301,一上碩班被指派了工作 平常有課要上 還有新環境的壓力 覺得自己比不上別人 畢業學校也比人家差 要報告但講話一直結巴 壓力大到直接得胃潰瘍,,,,,,,,,,
graduate_school,壓力,/f/graduate_school/p/240292359,從暑假進實驗室到現在 每天都是作業、報告、計畫、paper 半夜睡不著都在偷哭 覺得自己很不喜歡做這些事 每次都告訴自己讀完就有很多錢 但是每次壓力很大又被擊垮了 也不敢跟任何人說這件事⋯ 尤其是家人朋友  不敢說出考上台大可是不想讀了 大家都怎麼堅持下去的😢,,,,,,,,,,
graduate_school,壓力,/f/graduate_school/p/240301145,碩一到現在也過了快1/4了 每天壓力都很大 被實驗、報告、研討會、期中考追著跑 看著版上有關壓力大想休學的文章越來越多 到底是我太草莓還是碩士生本來就這樣生活 待在實驗室的想出去，外面的想擠進來 真的是考不上痛苦，考上更痛苦,,,,,,,,,,
graduate_school,壓力,/f/graduate_school/p/255087660,如題，常常聽到有人會說菸酒生，好奇問一下有人是本來不抽煙，後來讀研因為壓力大才開始抽的嗎？  更-會問是因為已經大概一個月壓力破表了，幾乎都是靠酒精渡過，現在在考慮其他紓壓方式,,,,,,,,,,
graduate_school,壓力,/f/graduate_school/p/241809360,為什麼讀研究所身心壓力那麼大啊啊啊啊啊,,,,,,,,,,
graduate_school,壓力,/f/graduate_school/p/255065597,更新：沒想到有這麼大的迴響！每一則留言我們都有看，不管是送上溫暖祝福、提供解決方案或是提出疑問的人我們都非常感謝，他說他知道自己能力真的不到教授的標準，但他學到了很多，其實一開始是做得非常有興趣的，可惜現在電池沒電了～🪫 現在休息重新充個電，在別條路上或許會有不錯的發現！ 對於所有分享了自己或是身邊同學好友鬼故事的人，沒想到一個比一個還鬼🥲很想給所有人擁抱說聲你們好棒！希望剛讀研、正在努力以及逃離地獄就業中的各位都能一切順心🧡請大家別忘記照顧自己的心靈～祝我自己也加油😂  正文： 大家好～我身為另一半看了很不捨難過所以上來發文看看大家的想法，文有些長還請大家見諒。  -男友就讀某國立大學電機碩- 指導教授是厲害的大忙人，講話很直接但撇開學術私底下人很好，曾經在男友旁邊聽過幾次線上meeting，老師講話真的是會直接擊垮學生信心的那種，大家時常都報告得很挫折。  男友的畢業project本來是三個人一起做，但一個後來受不了換題目，一個直接裝死消失Fade out，剩他自己在努力嘗試，很常卡關但都會問老師跟學長學弟討論，因為打一次實驗要花很久的時間，就這麼來到了今年，他在同一個地方卡了很久，各種討論跟在論壇網路上都無解，他才寄信詢問老師是否能給他一個方向或是讓他換題目（因為他真的做到心很累又憂鬱，已經沒有動力了），老師回覆說這已是最簡單的題目了，是大學生專題程度，如果無法解決是他自己學習能力跟程度的問題，他們無法幫助他，建議他直接找工作或換指導教授（碩四了欸⋯⋯）但他的project明明是博班學長做不出來留下的東西🥲而那個博班學長因此而沒有畢業，這樣也算大學生專題程度的東西嗎QQ  他看完老師的回覆跟我講了一些負面的話，我很難過，他覺得浪費了太多時間，他沒有經濟壓力但是爸媽給的壓力不小，開口閉口就是問要畢業了嗎，覺得他唸四年笑死人😢（或許是無心這麼說但聽了還是刺耳）目前他決定休學不唸了，想去當兵完直接工作，就當作止損跟完成夢想失敗，下週要去找老師簽同意書，結束這四年的碩班人生。我很心疼，但如果這樣他比較快樂我支持他的決定。  不知道這樣的事在工科碩中是不是不算什麼，網路上偶爾會看到類似的事情。,,,,,,,,,,
graduate_school,壓力,/f/graduate_school/p/234912336,喵哈囉~  上研究所不是推甄就是考試 常常看到準備考試的人在喊壓力大 推甄的就會回說 推甄整整三年分數錙銖必較 壓力也很大  所以我有點好奇ㄚ  究竟是考試壓力大呢 還是推甄壓力比較大  各位覺得呢？,,,,,,,,,,
graduate_school,壓力,/f/graduate_school/p/240195924,今年很幸運從中字推甄上頂大工科研究所，進了一個精實的lab。暑假進lab以來，每天都覺得壓力好大，雖然教授已經算不錯了（不會把人電到起飛），但可能因為程度的差異，還有自己個性的部分，常常會給自己很多無形的壓力，幾乎每天回家都會掉淚，覺得很難開心起來。 雖然很累很痛苦，但我確定我沒有休學念頭，會努力撐下去的，在這裡只是想請教各位過來人大大，有沒有什麼轉念的方法可以比較快調適好心理壓力！不然真的好無力好痛苦🫠🫠麻煩大家了🙏🏻,,,,,,,,,,
graduate_school,壓力,/f/graduate_school/p/239984333,明明整個暑假都在準備推甄的相關資料，自認為所有該做的不論是成績、實習、雙主修、競賽、科技部、多益都還算有達標  但想到自己是私立學校就覺得會不會因為這樣不能上想上的系 然後就會壓力很大會想逃避 最近在請教授寫推薦信，也因為對自己很沒自信所以多找了蠻多保底學校 導致跟我最好的教授要一個人幫我弄五個學校的推薦信 雖然我全部都會整理好、擬好內容給他們 但還是覺得很愧疚😭 最近真的好累 雖然一直告訴自己這過程也是了解自己的方式 但是還是會得失心很重 祝我跟所有人都推甄順利,,,,,,,,,,
graduate_school,壓力,/f/graduate_school/p/255027641,如題（不刪文 ，留給後人參考） 小弟的朋友今年考試錄取並找到 成大電機所（非ic實驗室2年畢業涼）和中字電機所(ic實驗室2.5～3年畢業微硬） 如果未來目標想走數位ic的話該如何取捨 1.成大  優 校名贏 可自己修課且有時間學自己想學的 2年畢業且壓力相對小 缺 碩論非ic相關找工作面試沒料  2.中字  優 碩論ic找工作面試有東西聊 會接觸到較多eda tool 缺 校名輸 2.5～3年畢業  想瞭解一下出社會工作的學長姐會怎麼選擇🙏,,,,,,,,,,
graduate_school,壓力,/f/graduate_school/p/254886513,"最近是研究所放榜，剛好看到之前整理的一些找實驗室的面談問題，順便丟上來分享一下 # 教授面談問題相關 碩班的新生，想要了解一下老師的研究方向或實驗室近年的領域 1.	可以問老師指導學生的方法是什麼? 會有學長姐帶嗎? 2.	問實驗室meeting的頻率、時間及形式 (有些是group meeting，有些老師會個別跟學生約時間單獨咪挺) 3.	碩一的時候主要是修課跟看paper嗎? 或是需要幫忙接計畫? 或是在旁幫忙學長姐的計畫? (遇過一些能力很強直升的都是大學時就在旁邊跟，碩一就會接計畫) 4.	實驗室近年的研究方向? 老師目前主要研究領域 5.	論文的題目是自己找還是老師會給方向? 或如果有接計畫，計畫內容可以延伸為碩論題目?  6.	老師在畢業的門檻有什麼要求? (有些需要投稿研討會或期刊論文，也有些老師規定論文有accept才能畢業) 7.	實驗室薪水? 8.     實驗室暑假可以找實習嗎? (有些老師規定不能去實習，可能會壓縮到研究進度之類的) 9.	進實驗室後會不會有基本training? 10.	老師有推薦哪本書或是paper可以先看?  有問題面談時盡量當面詢問清楚，避免跟學長姐講的有出入或網路上其他人分享的不一樣，也可以從教授對話過程觀察教授的個性之類的，當然也有老師面談時會美化自己實驗室，就只能也找其他實驗室學長姐問問看  ----------------------------------------------------------------------------------------------------------- # 可以詢問學長姐的問題 實驗室目前有哪些研究計畫或成果? 碩一修課量，會需要有研究進度嗎? 還是以讀paper為主 實驗室會提供多少薪水? 實驗室的作息如何，是否有規定幾點到實驗室、幾點離開，或週末需要去實驗室? 教授會讓學生碩二畢業嗎? 實驗室學生目前碩幾幾位? meeting頻率及形式? 還是meeting都是一對一接受教授的指導? 畢業學長姐都從事什麼樣的產業、工作性質呢? 實驗室會建議需要修什麼樣的研究所課程嗎?  最近想起以前在實驗室壓力好大，明明當初說去實驗室的時間很自由，但進去後才發現學長姐其實都待好待滿 (10hr是基本)，因為老師辦公室就在斜對面的原因，誰也不敢早離開實驗室QQ，祝福大家遇到氣氛好一點而且真正自由的實驗室  # 補充 萬一碰到不是最想簽的老師當場說可以收你，需要馬上給答覆? 如何應對? 可以跟老師說您是我第一位面談的老師或是後續還有約某某老師面談，但一定會盡快答覆您  假設是共指的名額 記得問清楚哪一位老師是主要指導的，需要兩邊都參加meeting? 指導教授跟論文是掛在哪一位教授的名下?",,,,,,,,,,
graduate_school,壓力,/f/graduate_school/p/254955537,準備系所：經濟學 台大經研：落榜 政大經研：落榜 成大經研：落榜 中山經研：正取  考試心態：一整年保持樂觀，相信自己會上台大 讀書時間：一天大約六小時（包含滑手機） 搭配歌曲：dj小慌（阿樂專屬） 搭配遊戲：暴走小蝦米  春班：告訴自己是個台大生，對手都是西瓜🍉 每天預習統計學。個經跟著進度走就好。  暑期班：稍微放鬆一下，總經課早上九點 起不來就不要去上，休息是為了走更長遠的路。朋友揪出去玩一定要出去，適當地放鬆壓力。但是這時候已把七百題刷完了  題庫班：壓力開始有些來臨，還有學校的課業，但是咱不怕，相信自己會上榜，畢竟我們的武器是絕對的自信。 計量經濟學就聽完回家寫一遍，上課千萬不要抄筆記，當音樂會在聽就好。寫題是最好搭配一些朗朗上口的rap,譬如說中國新說唱的歌曲。  課程結束：一月最後衝刺期，不怕，跨年還是要出門玩個兩天！這兩天千萬不能讀書，接著為了減輕壓力，最好是能有人來陪你談心談到深夜。  考試前一個禮拜：大概也沒心情繼續看書了，不然就寫點題目，晚上的時候看一些恐怖影片，讓自己的生活有起伏；然後記得去拜拜，神明的力量比熬夜苦讀還有用。  結論：考試期間千萬不要讓自己emo 感覺很痛苦之類的，要保持快樂，會越讀越快樂，網上看到有人讀到哭的，千萬別這樣，日子還是要快樂地過。,,,,,,,,,
graduate_school,壓力,/f/graduate_school/p/254993721,教授有口頭規定碩一要幾點到lab，一開始也是每天準時打卡，久了後就發現天天報到只有我和兩三位同屆，因為碩一沒什麼進度壓力，所以我大多都是去念書吹冷氣，但其他人演都不演直接不來，還是讓我有點不平衡，有些學長姊要學弟妹溝通，大都是我當中間人負責跟同屆通知，有點怪怪的。  不過跟同屆實驗室的人熟不起來，反而跟學長姊熟好像也不是什麼壞事？至少問問題蠻方便的，不過看到其它實驗室碩一都會一起努力念書、出門玩，心裡還是蠻嚮往這種研究生活的，不知道是不是實驗室各自行事才是常態呢？,,,,,,,,,,
graduate_school,壓力,/f/graduate_school/p/255264788,我去年從國立前段大學商科畢業，目前任職於上市櫃科技業ESG部門一年多，主要負責集團碳盤查，已取得ISO 14064-1主導查證員證照。  最近剛結束一輪碳盤查，開始有在考慮讀研究所，為此感到非常迷茫，希望各位可以給我一點意見🙏🏻目前有在看台大環工所環境管理組、台大森林環境暨資源學系、北大自然資源與環境管理所，因為本身沒有理工背景，台大環管組相較後兩者還是蠻偏理工，再加上我對生物多樣性還蠻有興趣的（雖然不確定在工作上可以發揮的會不會比較少），所以目前的想法是會以後兩個為主。  跟身邊朋友聊過，有些人會覺得現在在大公司的機會很難得，應該待在裡面多多歷練幾年，之後可以讀在職專班。但以目前的工作量、工作壓力來看，其實現在就常常處在崩潰邊緣了，因此我怕要再兼顧課業會兩邊都顧不好😿  因為現在還不是很確定研究所的必要性，不知道大家會覺得是否有需要再讀研究所，或是應該先專注在工作呢？希望大家可以給我建議～～如果有ESG工作相關問題也可以討論！先謝謝各位(*¯︶¯*)🙇🏻‍♀️,,,,,,,,,,
graduate_school,壓力,/f/graduate_school/p/254965980,目前碩二，實驗還做不完，還在趕實驗，論文也還沒開始寫。  之前經歷過換教授，在新教授這也是換過3次題目，真的開始做最後確定的題目，大概是剛碩二的時候，所以前面浪費很多時間做了一堆實驗，我很不希望延畢，所以都是沒日沒夜在趕。 自從讀碩士之後，身體就變得很差，皮膚炎、各種感冒、covid 19、流感、肺炎甚至是激素失調，幾乎都是在生病的路上，之前有半年也需要心理諮商。  最近家人瘋狂問我要畢業了沒，他們覺得論文很好寫，說看電視上的一樣，網路找找資料就掰得出來，他們來讀也能準時畢業，覺得我如果延畢真的很爛是草莓族。  我的題目不是教授比較喜歡的領域，感覺教授的重心也比較不在我身上，老實說很羨慕同實驗室的女生們，不需要想題目，有題目能接來做，因為碩一一開始就慢慢開始做，也比較沒時間壓力；最近教授的態度是催促我趕快畢業，對比同屆的人們反而是給福利希望能留或簽博，感覺是我不夠好，讓教授希望我趕快畢業。  同屆的人也在說我怎麼進度那麼慢，是不是平常都在偷懶，假借生病其實在外面玩，但明明她們在玩的時候，我都在趕實驗做報告，她們回家休息，我也還在繼續忙。  家中、同屆還有教授的態度，都讓我覺得我是不是真的如家人所說是爛草莓，所以才那麼趕，教授也沒那麼重視我。但明明我自己覺得我已經夠努力了。,,,,,,,,,,
graduate_school,壓力,/f/graduate_school/p/254989151,群名：「不自律人群 × 週打卡」 📍每週日打卡：紀錄自己的讀書進度 例如聽幾堂課、讀書範圍、寫題量，都可以 不用很詳細，自己看得懂就好  讀很少也沒關係 主要是想讓自己有壓力或動力 同時審視自己有沒有跟著計劃走  🔗限任何考生 or 天天讀書者,,,,,,,,,,
graduate_school,壓力,/f/graduate_school/p/254705212,過年教授給我們放2個禮拜 我每天都在焦慮論文的部分🥲  明天要開始咪聽了🥲 不知道大家進度到哪  我因為教授要退休了，瘋狂趕我們進度 說希望5月就口試 雖然知道不會延畢，但一直被趕壓力好大  兩年來完全都沒活動、沒實習就是一直瘋狂寫論文 好累啊～～～～～～～～～～～,,,,,,,,,,
graduate_school,壓力,/f/graduate_school/p/255094668,背景：頭上這間應用經濟系12% 經歷：會python 有專題 多益955   考試用書(補最大的那間）: 個體經濟魔法書 總體經濟魔法書 提綱挈領學統計 運籌帷幄學財管  課程規劃： 大三上上統計秋季班、大三下上個經春季班，財管和總經暑假上  時間分配： 經濟2 統計4 財管4，我一天差不多讀5-6個小時而已，然後我會花2個小時瀏覽band社團同學提出的問題並去解答，我真的很建議大家多逛社團，大部分同學提出的問題都很有水準的，有時候我可能花了一個小時思考同學的問題，非常享受這個過程  準備過程：  我自己在做題目有個原則，當我可以自己完整解出某個題目，我從此之後就不會碰那題，並且強調動腦思考，有時候可能一個題目我可以想一兩個小時，很推薦大家也這樣做  經濟-這科是我花最少時間但考試成績跟統財不分上下，我覺得應該是老師都用淺顯易懂的方式去解題，自然在經濟這科的負擔不會太重，對於沒有很想花很多時間在經濟的我非常適合。由於春季班已經上過個經了，所以我在暑假班只有上總經而已，這段時間就照著老師的小考去準備就好。到了秋天的題庫班，老師會帶很多學校的歷屆試題，我認為只要弄懂老師指定的題目，我覺得就很夠了，這次台大和政大的經濟很多都被老師命中。另外，強烈建議大家如果要考財金所，一定要參加老師財金的題庫班，畢竟這個班是完全以財金所的考試方向去設計的。  統計-這科由於我已經上了秋季班，所以我暑假主要就是先看提綱再去寫700題，有一點非常重要的是此時寫700題，很多不會很正常，但不要不會就馬上去看解答，如果想了30分鐘還是不會再去看解答並以自己的方式再寫一次。大概暑假我就把700題完整寫過一次，我之後重複這樣操作到12月吧，大概來回寫了700題五六次，然候12月之後開始寫各校的歷屆考題，然候我雖然沒報交大財金但我很推薦大家不管有沒有報名都去寫他們的考古題，你會有很大的收穫。計量的部分我覺得就跟著老師的進度就好，我自己是裡面的每一題都有寫過，差不多來回寫了三次吧。  財管-由於我暑假才開始上財管，我大概就是老師每教完一個章節，我回家就會先看運籌再去寫實戰不可的選擇題以及問答題我是以畫重點的方式進行，暑假班結束後，大概離題庫班有一個月的時間，此時我在把財管實戰完整寫過一次，然候不一樣的是這次我在把計算題也寫過，至於到12月之前，大概把實戰不可來回寫了五六次，12月開始再去寫各校的歷屆考古。  心態調整： 我其實一開始給自己的壓力蠻大的，常常看到自己的模擬考掉出第一頁我就會非常自責，但慢慢到後期，我開始吹眠自己有學校就好，築夢的過程才是夢想的價值，我的心態逐漸轉變無為而治的心態，心想只要這段期間有進步就好，落榜也沒關係，因此我在臨考前其實還蠻放鬆的。後期我主要就是泡在band社團，跟同學們相互討論題目讓我忘記考試的緊張壓力，真的我很感謝社團上不管是發問的或是回答我的同學，還有最重要的是統計老師的心靈雞湯讓我度過這一年。,,,,,,,,,,
