graduate_school,壓力,/f/graduate_school/p/241504512,目前念到碩二，但論文還在第一章打轉，在這過程中很容易會一直自我懷疑，覺得自己寫得很爛。  老師也說寫的東西根本不能看，身邊的朋友都在論文的水深火熱中，所以只能不斷跟自己說可以的，要撐下去……  最近每天都心情沒有很好，想到論文寫的很爛，進度又很慢，就很焦慮，也找不到可以讓自己放鬆的事情，想問問大家在寫論文的過程中都是怎麼調適自己的心情跟壓力的,,,,,,,,,,
graduate_school,壓力,/f/graduate_school/p/239728704,最近開始進實驗室參加meeting，在聽別人報paper時我感覺只聽懂了兩成，而且是片段的在不一樣的區塊，一部分是因為一些名詞的轉換不熟悉，還在咀嚼他的文字時他已經說完了，所以導致我整個聽完連接不起來，不知道他用了什麼方法解決的什麼…。  因為太晚備上，實驗室還有名額的不多，所以從剩下的實驗室中選一個稱不上是喜歡，只能說是相對還願意試試看的領域，本來就對這個領域不是很懂，實驗室又四代同堂，又因為教授說之後會接計畫，所以壓力有點大，而今天聽完paper更是有點打退堂鼓。  我心裡十分的掙扎，我考上的是四大資工所，家裡很期待我去唸研究所，不想辜負他們的期待，但才剛開始我好像已經不快樂了，基本上兩年畢不了業，怕之後計畫做不出來，心裡壓力好大。  想請問若是聽別人報告paper需要聽懂幾成，需要在當下就聽懂嗎？或事後會需要再去搞懂剛剛的paper在說什麼嗎？在聽paper時可以問那些基本名詞是什麼嗎還是該結束再自己查？ 以及有什麼方法可以讓自己讀研究所快樂一些嗎？  謝謝各位大德,,,,,,,,,,
graduate_school,壓力,/f/graduate_school/p/239686373,大家好 小弟這幾天第一次Meeting，有認識幾個同屆的碩零同學 聊了聊才發現所有人的學歷都好強 一個台大本科一個交大類似的科系..總之大家都比我好上很多 小弟只是個地名大學畢業，感覺實力上就是在同屆中最弱，心理壓力蠻大 想問一下有學長姊以前也是這樣的情況嗎，是怎麼走過來的阿? 已經有很努力補一些課程了，希望可以追上大家..,,,,,,,,,,
graduate_school,壓力,/f/graduate_school/p/253173938,目前我考上的是北部科大機電所  大學畢業之後因為沒什麼理由讀研究所想說先工作 結果就5年過去了 工作是在科技業當ME  原本我自己規劃是打算出國念研究所， 家人也很支持我那麼做 但後來備取上了也順利找到指導教授了，也因此開始了碩0生活   從4月開始，老師請我閱讀一些以後研究會使用到的文獻 還有學習之後研究會需要的知識 不知道是不是太久沒有當學生 雖然都有在學習，但總覺得都必須要花非常久的時間才能理解  看著LAB其他同學已經都進入實作階段了 我還在不斷的追著課程學習 在LAB也在看課程，回家之後也在看課程 越來越害怕自己的程度跟不上其他同學被老師唾棄   最近精神壓力好像越來越大 有的時候也會半夜忽然驚醒 雖然也跟自己說，應該只是不習慣而已 想說撐一學期看看，但越撐發現壓力好像越大而已 後天繳學費就要截止了 在想說乾脆就不要繳費了去休學了 但是又害怕老師會不能接受會被黑掉  忽然覺得我好草莓，明明工作5年了卻連這樣一點抗壓性都承受不了,,,,,,,,,,
graduate_school,壓力,/f/graduate_school/p/238803633,大家好 小妹執照系（醫牙藥之一）大三未來餓不死 對生科純科學研究感興趣 也有找到喜歡的實驗室 但是大家也知道生科的出路在台灣…不怎麼樣 心知肚明讀了對就業可能沒加分效果 各位覺得為夢想衝一波值得嗎？ 經濟壓力的部分：父母希望我早點出社會賺錢買房XD 可能還是大學生看法比較狹隘和理想化😂 希望大家給我一些建議 謝謝,,,,,,,,,,
graduate_school,壓力,/f/graduate_school/p/234343468,我應屆考上國立研，所上辦了迎新，自我介紹完一輪，很多人都不是應屆畢業生，各個都很厲害，突然開始自卑了起來，覺得是不是自己太自不量力，教授是不是面試的時候，沒有看出來我其實菜到不行，還沒開始上課，可是已經有很大的壓力了，朋友安慰我，他們很久沒讀書了，你班上前幾名應該還是能用功，來彌補不足，但我現在在考慮要不要休學了⋯⋯ 有沒有人有類似的經驗談😔😔😔,,,,,,,,,,
graduate_school,壓力,/f/graduate_school/p/241171912,本人背景： 私立大學工學院畢業 頭上這間管院碩畢  工作年資： 補教業2年 銷售業務3年  本身有程式底（但沒什麼作品），因為覺得現在工作薪資發展有限，想轉換跑道到科技業。目前有一些存款且沒有任何貸款壓力，但是擔心未來畢業後，太老了也找不到適合的工作。  請問各位大大，有認識同學30歲才在念研究所的嗎？QQ，或是畢業之後出路如何呢？,,,,,,,,,,
graduate_school,壓力,/f/graduate_school/p/234939085,這學期已經過了一半，還是覺得好難調適自己壓力，想請教大家怎麼調適？  從以前到現在，在旁人眼中似乎都覺得我是一個很努力的人，因為我求學的每一段過程真的總是能在到下一階段時，到達比我能力範圍好一階的程度，於是我就無限輪迴，（不知道要說我是幸運還是），造就我在每一次的階段在入學成績上都是處於後半的，所以我自己的心態都是我不如別人，一定要比別人更努力，以至於在旁人眼中我好像一直都是努力認真的角色，到大學我依然還是這樣的情形，於是也幸運推甄上了現在的研究所，但是這次不一樣的感覺是我覺得我不只跳了一階，我跳了好多階，跟以前不一樣的是讀研究所後總是有那種我努力了很多也追不上身邊的同儕的壓力感。  （自己也有在想是不是大四想說要讀研究所，學長姐也說以後玩不了了，所以大四盡情玩，導致現在心態上還沒有轉換的很好也還沒有調適好）  補個當初想讀研究所原因：一來是希望未來能找好一點，薪水高一點的工作（理工科系好像要讀研才比較容易達到），而且大學真的不覺得自己有學到什麼東西，再來是不想辜負父母的期望。,,,,,,,,,,
graduate_school,壓力,/f/graduate_school/p/237227690,各位大大好 小弟念研究所唸到碩二  自己的實驗不僅卡關而且研究方向教授也沒有給得很明確，外加自己憂鬱症變得很嚴重，因此萌生想要休學出去考公職的念頭。  但仔細想想好像出去邊工作邊準備考試的壓力也不亞於當研究生，聽說痛苦指數超高....QQ  因此，想請教各位大大哪條路會比較好走  P.S.我沒有跟指導教授吵架，只是單純教授蠻廢的而已WW,,,,,,,,,,
graduate_school,壓力,/f/graduate_school/p/234871421,政大是我從大二開始決定的目標學校，我也沒想到有一天居然夢想成真了，在過程中我也曾經懷疑過自己、壓力大到做惡夢，沒想到最後卻是正取上榜，真的真的很幸運，也想把這份幸運分給大家。無論是正在準備推甄或是考試你，希望也能去到想去的地方。   我是前情提要這篇的原po，心得跟題目都分享在下面這個連結上了><,,,,,,,,,,
graduate_school,壓力,/f/graduate_school/p/254019161,我是今年推甄上中央大學藝術學研究所、以及師大藝術史研究所西方組的學生，目前我是根據自己想研究的方向找相對應的老師來選擇學校，但仍想詢問兩校的學長姐能否分享系上師資、課程內容、授課方式、課業壓力、環境等等的心得，讓我做進一步的參考並選擇學校～ （想另外詢問兩間學校都有報考的學長姐最後是如何決定選擇就讀其中一間的！）  非常感謝🙏🏻🙏🏻,,,,,,,,,,
graduate_school,壓力,/f/graduate_school/p/232835090,這邊問一下  這裡有沒有在高第一讀在職專班的學生🤔（工學院） 如果報名了好上嗎？ 貴校在職專班好過嗎？ 壓力會不會很大？工作與學校雙邊無法兼顧的情況發生？ 正常是不是無法正常準時畢業呢？ 建議先工作一兩年再進去進修補學歷比較好 還是大學應屆畢業生無縫接軌直接就讀呢？ - 如果有貴校的大大在或者了解的能否給點回應 因為小弟我還在猶豫要不要報名🥺,,,,,,,,,,
graduate_school,壓力,/f/graduate_school/p/238215209,拜託大家幫忙填問卷救救研究生，祝大家都能成功登岸🙏🙏 感恩的心 感謝有你🥰🥰  問卷名稱：交辦工作任務之壓力調查 研究目的：探討員工與主管關係之工作壓力關聯  填答條件：任何形式在職者（包含全職、兼職、實習、工讀等）  其他聲明： 1.作答時間約3-5分鐘  2. 本問卷以不記名方式填答，且無標準答案，請您仔細閱讀填寫說明和題目後，依據您的真實狀況，在每題題目上圈選您的對應答案。  3.您可以自由決定是否參與本研究，在填寫過程中若有任何因素，亦可選擇隨時終止作答，且無須向研究者說明原因。  4.資料僅作學術研究使用，不做其他任何相關用途，且研究者謹守保密守則，所蒐集之相關資料都將進行匿名且加密處理，以確保您的隱私。   研究單位：元智大學管理學院碩士班（領導暨人力資源學程） 研究者姓名：謝菡婷 聯絡人姓名：謝菡婷 聯絡方式：s1107206@mail.yzu.edu.tw  問卷連結： 回饋獎品：待資料收集完成，將隨機抽取30位同學獲得7-11超商$100禮卷 。若您有意願參加抽獎，可於問卷最後留下E-mail，此電子郵箱僅用於聯繫中獎者，請您放心。  問卷截止時間：3/7（一）中午12:00,,,,,,,,,,
graduate_school,壓力,/f/graduate_school/p/239209044,面試心得  第一個問題要求自我介紹，我介紹自己的專題，基本上斷斷續續，因為都不是自己做的，所以都很結結巴巴，面試官聽到一兩分鐘就說，為了節省時間，要一問一答的方式進行  為何想報這個學程？ ：因為大學學的不夠多，想要好好更努力在碩士學更多 p.s.早知道就說綠能科技是國家政府的綠色政策重點目標  工作前將如何自修？ ：未來工作前會好好補修進階知識等等  進階知識對未來工作關聯性？ ：思緒訓練  人際關係如何？ ：沒朋友  在工讀或社團，是否有共同完成一件事？ ：沒有  怎麼紓解壓力？ ：無聊打遊戲拍實況  壓力來源？ ：人際關係不好  研究所兩年規劃？ ：跟上課程規劃  修過最爛的科目？ ：工數，還重修  自否獨立完成一個專案？ ：大學部專題影像辨識（答非所問）  我說「獨立」完成一個專案 ：獨立完成拍實況與斗內的設計，但沒人看  為什麼系排那麼爛？ ：因為工數被當，但努力補修了（講的很心虛）  過程中都是業界高層問比較多同事關係的問題，問題差不多佔了6成吧！剩下都是問自否有獨立研究的相關問題  面試過程真的超級緊張，面試官一直叫我表現自我，但真的很想上，表現自我就真的上不了了，覺得我涼了,,,,,,,,,,
graduate_school,壓力,/f/graduate_school/p/253856608,我是去年推甄仔  近一兩個月是推甄潮  不管出來的結果是正取或備取  都要相信自己會上的  能夠上自己最喜歡的學校  考試仔也不用太擔心  好好準備  到時候每一題都能迎刃而解  就算不會寫該題也能摸到一點分數  不要給自己太大壓力 有時反而會搞砸  祝大家都上岸！  (大家也可以來我頭上這間學校 雖然門檻不是最高的 但至少你在這邊不會擔心生活上的問題 不要變太胖就好),,,,,,,,,,
graduate_school,壓力,/f/graduate_school/p/236651404,昨日做夢夢到，有雷同純屬巧合  陳: 幾年前電子所王牌 以往只收台大電機學生 做多媒體影像相關 這幾年在科技部 所以收的學生極少 資訊不多 剛從科技部回來開始收學生 實驗室人數不多 對學生要求高 畢業年限: ?  吳: 聲望極高大老 放榜前常常就收滿 只收電神 做AI和DSP相關 開發演算法不太做硬體 實驗室博班陣容眾多堅強 博班帶領碩班做計劃 計畫就是題目 壓力極高 畢業年限: 2   闕: 做AI和通訊 硬體為主 實驗室沒博班 對進度要求高 沒進度可能被念 畢業年限: 2-2.5  楊: 做AI生醫通訊 硬體為主 博班人數眾多堅強 名額很快就滿 要求高壓力大 畢業須發paper和下晶片 畢業年限: 2.5  盧: 做生醫影像 硬體為主 為人和善 較不會要求進度 需要self-motivate 蠻多人跟他做專題 畢業年限: 2-2.5  劉: 做AI 物聯網 資安 節能IC 硬體為主 為人和善 似乎蠻多人對他實驗室有興趣 原數位類比都做 去年開始不收類比學生 畢業年限: 2.5-3  簡: 做多媒體影像 實驗室做硬體不多 在外面開公司 找到他極難 為人和善 畢業年限: 2-2.5  李: 類比數位都做 很神祕的人物 資訊趨近於零 貌似有在開公司 聽說蠻多人逃走 畢業年限: ?  夢到這就醒了 夢境印象模糊 歡迎留言補充,,,,,,,,,,
graduate_school,壓力,/f/graduate_school/p/239572606,碩班壓力好大好忙 也沒什麼朋友 更不用說女朋友了  社交我很不擅長 平常也沒時間參加其他活動認識別人 大多數時間幾乎也都是一個人過 偶爾是會跟實驗室同學吃吃飯而已 然後又是母胎單身  常被問的就是有沒有交女朋友的問題 連去實習也被一直問 家人最近也一直問  而且實習超忙根本是更沒空閒生活 同事還說盡量趁學生時期交一個 不然出社會後根本就沒時間了 嗚嗚嗚… ,,,,,,,,,,
graduate_school,壓力,/f/graduate_school/p/239685641,嗨大家好！ 小女子在搭火車時突然靈光乍現🤩 原本以為出國讀書的夢要被迫放棄 突然讓我想到研究生也有交換學生 （我的黑白人生要變彩色的了嗎？🥹🥹🥹  不過！ 還是想先問看看大家 通常都是在碩一還是碩二申請？ 因為讀諮商所本來就不會如兩年畢業 諮商所有實習的必修壓力 若再加上到國外交換的時間 會不會又更提升了畢業的難度？ 像是回來要補很多學分之類的？  歡迎大家一起討論🫶🏼🫶🏼🫶🏼,,,,,,,,,,
graduate_school,壓力,/f/graduate_school/p/240290823,已經開學快一個多月了 開學後接踵而來的壓力，還有不斷熬夜卻做不完的事 不管在生理、心理，都對我產生極大的影響  開始容易心悸、胃痛、失眠 這些以前幾乎不會發生在我身上的  雖然預約了人生第一次諮商 可是要等好久 每個晚上流著淚，可是卻沒有人可以訴說  聽著諮商中心電話那一頭傳來的嘟嘟聲 明明知道不會有人接卻還是打了過去  快齁不住了卻還是得死撐著 好想休息，真的,,,,,,,,,,
graduate_school,壓力,/f/graduate_school/p/254374841,目前碩一，實驗室剛好只有一對學長姊，關係非常友好！！學姊對女生的敵意都很重，不管是我本人或其他實驗室的同學。有時候問她問題愛理不理，問學長 學姊又會不開心，有時候參加活動都會明顯被學姊排除在外，真的不知道該怎麼跟他們相處⋯⋯覺得心理壓力很大🥺  曾經試著跟教授講過，但教授覺得學生之間的相處不是他應該管的，我們是來學習的⋯⋯  想問看看各位，如果遇到這種狀況，該怎麼解決，謝謝🙏,,,,,,,,,,
graduate_school,壓力,/f/graduate_school/p/234724979,想請問有沒有面試過的學長姐能告訴我推甄面試的時候會問什麼問題之類的 上次在中興遇到英文關真的很難⋯⋯彰師不知道會不會也有 有些人可能會說考這個學校這個系沒什麼用...但是對我來說是有很大的幫助以及肯定，每個人的目標以及理想都不同⋯⋯  報名人數19 錄取10 雖然機率很大我還是想問問板上的各位大大 相較之下中興160人錄取14這個壓力稍為沒那麼大,,,,,,,,,,
graduate_school,壓力,/f/graduate_school/p/239894076,目前已經就讀去年推甄上的學校，但因為北部物價跟房租，還有交通費等等的開銷的問題，外加也很想回南部讀書，想問大家在推甄的時候能夠提目前就讀的學校嗎？並說明利用這一年時間修課補足自己不足的地方。還是就說因為經濟壓力的問題就好  也想順便問一下大家備審要繳交的成績單是要系排還是班排？因為我原學校不給畢業生申請歷年系排，只能申請班排，大家的學校都是這樣嗎？,,,,,,,,,,
graduate_school,壓力,/f/graduate_school/p/233477174,不知道發在研所板適不適合 但還是想請教現役研究生給一點建議 以下先講故事，才好讓大家了解我的想法  各位好，小弟畢業後在銀行工作了1年左右 銀行畢竟是業績掛帥的地方 所以有些時候難免都要半哄半騙的賣產品 雖然說在學校同學都說：「你很會說話欸好業務嘴」 但那都是熟人之後才會一直講話講不停 真的跟陌生人聊天例如客戶，講完產品之後我真的沒辦法尬聊了 而且我又不是很不喜歡一直跟人拜託一直叫人買東西 有時候被客戶拒絕我就放他走了 時間久了那種壓力真的越來越重 除了業績壓力之外，還有不太想一直和人講話的壓力 所以想說內轉看看內部有沒有其他職缺可以不用賣東西的 因為現在金融業都在拼數位化，所以很多職缺都是要會coding或是資訊相關科系的人 所以我就去買一本資工系同學推薦的書開始練後來也有去上線上的Python課程學爬蟲 雖然一開始學有點眼花但是發現會寫code好像蠻有成就感 覺得好像離轉換跑道又近了一點點XD 以上講得有點多了...  我今年考了3間資管所：成大、中山、高科 很不幸成大中山都落榜，高科有上榜 因為我知道大家都認為科大只有台科北科可以讀 所以我就打電話問我們公司的HR 她說：「我知道你顧慮的點，但我更在乎的是你可以拿出什麼skill。」 雖然不知道她是在安慰我所以騙一下，還是認真思考過後才回答 但是這幾天我一直在思考到底該不該讀下去 我爬文發現很多人就連高科的校友都勸退大家別去高科，建議+365 但是我已經25，所以沒有再重考的打算 其實我個人的想法是偏樂觀，進去認真做研究、認真練英文、認真練coding、認真被奴役 換一張資訊相關背景的碩士學歷，雖然不是前段學校  但我的目標是能夠跨領域進入銀行業的IT或者可以進入資訊業 如果只有高科資管這個選項  A.是去把他讀完，2年認真修煉，拿文憑，至少讓HR知道你資管畢業的  B.還是繼續邊工作邊精進自己的程式語言能力，順便做點side project，養一些小成果出來  請問大家會如何選擇？ 也謝謝大家耐心看完～,,,,,,,,,,
graduate_school,壓力,/f/graduate_school/p/239086690,我今年剛26歲，大學是念法律的，出社會工作三年才決定回研究所唸書，目前姑且算是補教老師，之前也有在高中當過兼任教師，因為對教育有興趣，今年準備要去念師大教育學系碩士班了，目前尚無教師證，由於外系念教育還要補修教育學分，想問有沒有跟我一樣是外系轉教育的？請問一邊念碩士學程，一邊下修教育學分，課業壓力會不會很大？想聽一下過來人的經驗談和建議 感恩,,,,,,,,,,
graduate_school,壓力,/f/graduate_school/p/240578639,各位學長姐好，想請問我預計明年報考台師大的休旅所，看到餐旅組很多課程都是「全英授課」所以意思是完全不會講中文了就不是像雙語教學那樣嗎🥺 因為小弟我本身英文程度沒有到太好，怕到時候很有壓力。 想問有沒有所上的學長姐，可以分享一下休旅所餐旅組的課程進行模式或所上老師上課氛圍等等。 目前大三系排是4% 也做了很多的努力及拓展相關經驗，真的很希望能進入師大休旅所🙏,,,,,,,,,,
graduate_school,壓力,/f/graduate_school/p/240023793,不好意思，想請問各位 因爲我是讀護理夜校的（因為當初有經濟壓力） 現在已經在職場上工作三年了，也順利晉升N3，但因為輪班真的很累，所以目前想要繼續讀書，考取研究所（目前目標是想考取國立的研究所），之後當實習教師之類的 但因為都要繳交成績單，那想知道，如果面試官看到我是夜校畢業的，會因為這樣而稍微扣分嗎？ 因為看許多面試官都會詢問在校成績 謝謝各位！,,,,,,,,,,
graduate_school,壓力,/f/graduate_school/p/253697870,113環工推甑請益 班排（系排）：13  工作經歷： 在CCP 實習三年半 工讀生  畢業後在傳產 當輪班技術工程師 一年多 （在業中）  證照： 電腦硬體裝修乙級 堆高機 第一種壓力容器  因為都半工半讀 找不到時間 去考環工類證照  推甑系所： 1.中山環工（在職專班） 2.高科大環工（在職專班） 3.屏科環工 （在職專班）  因為我是私立科大加上我沒有多益，所以極度沒有自信，想請教學長姐們，我這樣的經歷大概有機會落在哪個區間～,,,,,,,,,,
graduate_school,壓力,/f/graduate_school/p/253946511,各位備考過程辛苦了，小女子弱弱問一下有沒有高雄的版友有意願一起組成讀書會， 若地點不方便也可以線上讀書會的形式進行 主要功能是希望大家可以互相督促讀書進度、考情資訊共享、討論考古題以及之後考完筆試一起練習諮商演練等。 壓力大的時候也可以一起去吃飯、去景區散步、去廟裡拜拜之類的 目前希望組成3-4人的讀書會 有意者歡迎私訊我 祝福大家如願以償夢想成真☺️,,,,,,,,,,
graduate_school,課業壓力,/f/graduate_school/p/239692356,準備升碩一 修課會很忙預計接實驗室計畫也會很忙 但最近遇到一個我很中意的女孩 交談的過程也感覺對方對我有好感 關係很對等 但我覺得現在的情況根本不允許我談戀愛 談下去根本沒時間陪對方 怕會錯過人家 唉 想問這種狀況大家會怎麼做,,,,,,,,,,
graduate_school,課業壓力,/f/graduate_school/p/253834373,（怕被認所以借朋友帳號發文，不是頭上這間） 我目前是碩一，超級內向又慢熟 花了整整一年的時間才跟現在的朋友變很好，而且還是對方超級積極的靠近我 現在進了一間所有學長姐都是超級社牛的研究室 他們感情很好，常常約去吃飯喝酒聚會什麼的 我跟同期進來的碩一感覺頻率也對不上 我很常不懂他們的思維跟行為模式 雖然每個人都很親切，但就是覺得有牆隔在中間 然後研究室大家做什麼都要一起 我就是跟大家不熟所以偶爾會去跟朋友混 學長跟教授就會問我怎麼不跟他們一起走什麼的 說我們這屆感情不好，壞了傳統 講到我真的覺得是情緒勒索的地步了  拜託，我已經很努力要融入大家了 還參加了我根本不會參加的局，但我真的需要時間 而不是一直叫我跟他們綁在一起，只會讓我更反感 我也知道這是我的問題，不能因此覺得他們怎樣 但我真的壓力好大，每天都想躲起來一個人 我感覺自己像誤入什麼異世界一樣 整個研究室只有我是怪人 大家應該都知道社交對內向的人是非常耗能的 每天進研究室都覺得好累，我只想當獨行俠 會選這個教授是因為研究領域，還有其他老師給我的建議，加上我想轉行 也有先跟學長姐聊過才選擇進來 知道大家很活潑，但不知道會那麼瘋 沒想到人際壓力會讓我那麼精疲力盡  真的好累⋯課業壓力比起人際關係真的小菜一碟 不知道要怎麼辦，現在的情況讓我好絕望,,,,,,,,,,
graduate_school,課業壓力,/f/graduate_school/p/238410931,研究所版的同學、學長姐們好～ 我在今年有幸考取了交大傳科所與政大的傳播所， 兩間學校都很好，我也做了不少比較， 目前考慮到畢業時間與課業loading的部分，由於網路上比較難找到相關資料， 想來這裡發問，看是否有目前在學的學長姐：  1.是否可以分享自己在所上看到的大致畢業時間，是否有可以兩年畢業的同學？是多還是少呢？ (自己應該是偏向做量化研究，雖然知道畢業時間跟指導教授有關> <但還是想問問看學長姐們的情況）  2.進去後的課業壓力如何呢？ （目前有聽說傳科所有投稿壓力，碩一進去壓力會比較大、然後似乎不管哪間都有大量的paper份量）  希望學長姐可以協助徬徨的碩0生做選擇，我這幾天已經想到就開始焦慮再次感謝～～祝福大家論文順利、口試順利！,,,,,,,,,,
