graduate_school,壓力,/f/graduate_school/p/253107952,本人碩0 暑假就進實驗室學東西 一開始其實沒有很累 就看課程學基本的知識 但最近老師派了好多功課 這些都是大學沒碰過的 好難上手 老師還把期限壓得很緊 每天都早8晚9 一天只有看到一次太陽 壓力真的好大 本來會重訓當作休閒 現在也沒有時間🫠🫠 讀的是電資研究所 考上後才知道上榜是痛苦的開始,,,,,,,,,,
graduate_school,壓力,/f/graduate_school/p/254327446,我自從上研究所以來，覺得自己一直在累積壓力，其實事情不算真的非常爆多到會跨不過去，但還是需要熬夜完成跟燒腦。  從碩一開始很多必修課，步調變得很快，我開始變得很焦慮，只要一天沒有好好念書追進度，我就會異常焦慮，也很常熬夜看書，當時生理時鐘有點亂掉，早上也容易睡過頭⋯  我們所是需要做實驗的，也承受了很多實驗失敗跟進度壓力，也經常覺得不管是seminar 或是實驗室相關領域，都好希望能有人可以帶我，讓我認識的更快。當我卡在一個地方很久，詢問人未果，也暫時解不出來的時候，我又開始有點害怕，因為我總是會預想我後面還有很多事要做。  不知道為什麼上研究所會這樣，我在大學的時候還保有對自己學習內容的熱忱，也根本不擔心這麼多，就是事情來了就做，當時因為有這些熱忱支撐，做事效率還不錯，也會有意想不到的靈感，但現在開始會因為認為和身邊的人相比進度落後，就會責怪自己很笨，有很多事都沒辦法單靠我自己解決，然後之前事情的壓力也會累積到現在，甚至會預想到更以後。  我有點需要一個正向想事情的意見，讓我可以多點不一樣看事情的方向。不然真的好不舒服。,,,,,,,,,,
graduate_school,壓力,/f/graduate_school/p/237998576,本人目前在四大讀研究所。因為研究所跟大學的讀得科系不一樣，所以讀起來還蠻痛苦的，每天都活在壓力之中，睡覺做夢都夢到被老闆噴爆。  近期產生休學去工作的想法，但是我爸媽一直跟我說去工作比當學生壓力更大更辛苦。我自己目前只有打工的經驗，沒有真正的工作經歷，所以不知道是不是真的像他們說得那樣嗎？  想發文問問有經驗的大家工作和讀研究所哪個壓力比較大？在抉擇上有什麼建議嗎？  謝謝大家！,,,,,,,,,,
graduate_school,壓力,/f/graduate_school/p/237815057,小弟我是GG登出仔 目前有在考慮要不要讀研 最近跟大學同學聊天 他是交大某間很硬的實驗室畢業的 平常在實驗室主要是做計畫幫教授賺錢 教授基本上不管你的碩論只管他的計劃 我同學碩一做了3個計畫卻沒一個是他的碩論 碩士論文提案也是一直煩教授才勉強能提出來的 後來熬到口試完還是畢不了業 口試完教授還是一直叫他做計畫 完全不看他的論文 最後是搞到憂鬱症教授才放他走 從口試完到拿到畢業證書好像耗了半年 我同學目前在GG18a黃光設備待了2年 聽他說GG設備比讀研壓力小多了 他實驗室同學跟學長在台積都過得很適應 但說真的我實在很難想象壓力比GG大的生活 難道讀研壓力的壓力真的有可能比在GG壓力大嗎？,,,,,,,,,,
graduate_school,壓力,/f/graduate_school/p/240520500,這陣子忙完了研究所推甄 面試完等待的時間  剛好也讓我沈澱了一下想了很多  🔸首先第一個問題就是「我到底適不適合讀研究所」  想先說明一下，我自己其實是一個很容易緊張跟焦慮的人，也在大學時期被診斷焦慮症。嗯⋯對⋯我是個焦慮症患者⋯ 我可能需要補充一下我的狀況：焦慮症程度的話可能落於中重度焦慮。 嚴重的時候會想傷害自己或是一直處於抑鬱想哭。壓力大的時候很像是汪洋裡找不到浮木溺水的人，呼吸困難、身體狀態糟糕開始重度感冒，然後一直嘔吐、胃食道逆流嚴重、頭暈身體不適、心悸⋯等。  在大學期間我因為擔任專題組長壓力大到沒辦法上台報告，然後身心崩潰⋯ 還有在每一次的期中期末考試我都會超級緊張然後精神緊繃 其實一直以來我都很清楚是我的焦慮症在作祟，尤其每每在學業方面我就會非常苛責自己然後逼著自己做到最好。 這個取決於我過去家裡長期都是給予高度壓力在我的課業上  所以即使我父母高中畢業後就不會刻意管我們的成績，但是他好像就變成一股莫名的聲音一直在壓迫著我。  但是它很神奇，雖然讓我在有一番成就前苦不堪言 ，但通常最後成果都不會太壞。 我大概會從感受到壓力後，就開始重度的感冒，然後身體心理狀況都很糟糕。 但是經歷完這些痛苦 ，過了這個坎之後我的身體跟心理就舒坦許多也就會恢復正常了。  然而這個情況又在我這次準備推甄的過程中又再一次的跑出來  我其實是已經在職場工作的人， 出來工作後更加確認自己未來的職場目標與方向，也很確認自己對於自己熱愛的領域很有企圖心想學習。 不否認的是，我這次決定考研有很大一部分是因為我的職位需要研究所學歷，才能到大公司做到更專業的事情，不然就只能小媳婦熬成婆還不一定能夠有一番成就，薪水也很難快速提升。 而讀研究所是我拿到快速通關的一個門票，我自己也加入了線上的學習課程考取領域相關證照跟學習，所以我是很確定自己的目標與動機。  但是經歷過我這次的推甄準備 我有一點點卻步了⋯ 因為這次準備推甄的後期我經歷了非常劇烈的身體跟心理上的折磨 我也發現我的身體沒辦法一次又一次的負荷這種折磨跟壓力 如果讀研究所壓力會大到讓我焦慮症一直發作，然後每一次發作都會這樣折磨我 我想我得認真的考慮到我的身體狀況  （主要是看到版上大家都說讀研壓力很大） 但是我自己是一個有點固執而且對於自己高要求又很執著的人 總想拼命的達到目標然後享受那份目標帶給我的喜悅 也因為這樣的特質也讓我獲得不少成就 像是獲得系排第一、有亮眼的活動表現⋯  這次考研大概65%是我有強烈企圖心想要讀、並且持續朝著我的目標學習跟邁進。 再來35%是我爸爸他是一個社會地位算不錯學歷也很優秀的人，他對我其實一直以來都有一定的要求，我也很希望能夠成為他們的驕傲。 但我的個性比較有主見，今天如果不是因為我想考我也不會那麼認真準備。 所以我到底我還是為了我自己跟未來、目標而做這件事跟前進。  但是前提是我得克服我的焦慮症⋯ 目前有持續諮商、吃藥治療 但因為這個病灶已經太久了，會需要一段時間慢慢好。不能保證什麼時候會好，但是至少我很努力讓自己變好，但還是對於讀研究所的事情很困惑跟迷茫，我到底適不適合呢⋯我這樣焦慮症的狀態下真的有辦法應付嗎⋯  考研這件事除了身邊幫助我在研究所考試路上的親友外，連我爸爸媽媽都不知道，因為對我來說爸媽跟家人在考研這條路上會是我很大很大的壓力源，所以現在已經面試完學校了，我也還沒跟他們說，但是我知道如果到時候有確定要去讀，勢必要和他們溝通⋯ 🔸這就是我的第二個問題「怎麼跟他們溝通我的狀況」 因為他們一直對學業很要求，除了時不時就會希望我可以再往上讀他說會支柱我，然後對我們家每個小孩的學業都是極端要求。 但是一旦他們知道我考上研究所而且想去讀，他們就會希望我一定要讀完，我媽媽是那種如果小孩有成就就會喜歡在親戚面前大肆宣傳炫耀的人，我爸爸則是對成績學業很要求的人，但如果我決定確認要去讀，我並不想成為那麼手上炫耀以及要求的對象⋯ 就像是我這次面試我也是自己準備自己去好，全部都因為是「我想要」，而我如果決定去讀我就會以身體健康為優先，去讀了過後至少完成我一個里程碑跟夢想，如果真的不適合，身心狀況扛不住的情況下，最壞的打算就是我休學。但是我想我爸媽應該會不同意⋯  我也替自己想方案如果他們覺得是錢的問題，我願意為了我的決定負責任，休學後之前讀研的錢我可以全部還給爸爸。 然後就再返回職場工作⋯  雖然已經思考那麼多了⋯但我還是對於要跟他們討論這件事感到好焦慮 不知道有沒有人可以跟我一些意見呢 針對以上的兩個問題⋯😢  也誠心地感謝看到這裡的大家 因為文章真的很長⋯ 但是我真的很需要大家的建議與看法 希望能夠讓我有更多的想法跟解決方法 謝謝,,,,,,,,,,
graduate_school,壓力,/f/graduate_school/p/253834373,（怕被認所以借朋友帳號發文，不是頭上這間） 我目前是碩一，超級內向又慢熟 花了整整一年的時間才跟現在的朋友變很好，而且還是對方超級積極的靠近我 現在進了一間所有學長姐都是超級社牛的研究室 他們感情很好，常常約去吃飯喝酒聚會什麼的 我跟同期進來的碩一感覺頻率也對不上 我很常不懂他們的思維跟行為模式 雖然每個人都很親切，但就是覺得有牆隔在中間 然後研究室大家做什麼都要一起 我就是跟大家不熟所以偶爾會去跟朋友混 學長跟教授就會問我怎麼不跟他們一起走什麼的 說我們這屆感情不好，壞了傳統 講到我真的覺得是情緒勒索的地步了  拜託，我已經很努力要融入大家了 還參加了我根本不會參加的局，但我真的需要時間 而不是一直叫我跟他們綁在一起，只會讓我更反感 我也知道這是我的問題，不能因此覺得他們怎樣 但我真的壓力好大，每天都想躲起來一個人 我感覺自己像誤入什麼異世界一樣 整個研究室只有我是怪人 大家應該都知道社交對內向的人是非常耗能的 每天進研究室都覺得好累，我只想當獨行俠 會選這個教授是因為研究領域，還有其他老師給我的建議，加上我想轉行 也有先跟學長姐聊過才選擇進來 知道大家很活潑，但不知道會那麼瘋 沒想到人際壓力會讓我那麼精疲力盡  真的好累⋯課業壓力比起人際關係真的小菜一碟 不知道要怎麼辦，現在的情況讓我好絕望,,,,,,,,,,
graduate_school,壓力,/f/graduate_school/p/253662520,最近不知道是不是因為準備推甄面試的關係 知道自己校名不好看，成績也不太好 只有實習經驗、專題還有研討會發表可以勉強補強 看著許多頂大的同學跟我推同一間，壓力好大 吃不好也睡不好，沒有確診也沒有流感 但不斷低燒頭痛全身無力，吃藥也沒有改善 推甄結果還要一個月才會出來，覺得好煎熬 過去去實習單位拼到每天熬夜都沒這麼難熬 不知道有沒有人有可以調整好心態的方法😔 這邊預祝大家都可以上自己的理想系所,,,,,,,,,,
graduate_school,壓力,/f/graduate_school/p/241491805,實驗室成員有兩個博班學姊一個博班學長（但學長因為實驗關係很少跟他有接觸）跟兩個大學部學弟還有我 我主要都是給學姊帶 學姊平時也都對我很好 只是如果當他心情不好的時候就會有一股很強大的氣場 如果不小心犯錯了 或是其實根本沒犯錯就會挨罵 也常常會有我覺得很莫名其妙的時候 像是每次討論實驗學姊就會說 ：要我有自己的想法不要都照學姊說的做 我照自己的想法做後 結果被罵 ：為什麼你要這樣這樣這樣 我是這樣教你的嗎？ 還有各式各樣的情況 造成我現在常常會提心吊膽學姊是否在生氣 現在越來越覺得壓力很大 快要撐不下去了 所以上來抒發心情 順便找找看有沒有同溫層取暖,,,,,,,,,,
graduate_school,壓力,/f/graduate_school/p/240479073,好想知道大家是怎麼調適的，每次我都感覺老師都對我不耐煩，又加上老師把我當助理在用（目前碩一）整個壓力超大，自己的東西都弄不完了還要弄老師的東西，然後還要每個月報paper給老師聽（我又看超慢），我真的快不行了嗚嗚,,,,,,,,,,
graduate_school,壓力,/f/graduate_school/p/253990878,雖然不知道能夠在這裡得到什麼 但還是想發文抒發一下考研的心情 或許能找到同溫層(?希望不要 願大家都是順利的  最近壓力真的好大 回首大學這幾年真的遇到很多挫折 各種和預期完全大相逕庭的結果 又或是措手不及的意外 仔細想想好像真的沒有發生過任何一件順利的事情 印象有一個學期壓力真的特別大 每一天都只能與失眠共處 還深怕自己憂鬱 那時候真的跑了好多次的輔導室  前陣子推甄結果放榜了 原本以為至少會有學校上 結果一間都沒有的通通落榜了 至於考試 原本只是當作下下策 推甄真的沒學校再來考試 所以把重心大多放在推甄 好好準備書審 所以沒有像直接準備考試的人那樣全力的衝刺 所以連正課都還沒看完 而且中途一下忙這個一下忙那個 記憶也都掉得快差不多了  眼看只剩兩個月的考試 除了讀不完的書 加上一連要考好多天 報了好多間學校 南北奔波的壓力似乎讓我有點扛不住了  其實自從落榜之後 每天都是重考的念頭 很想跟家人坦承自己的狀態好像真的沒辦法參與這次的考試 可能要+365了  對父母真的很抱歉 他們總是告訴我 凡事盡全力就好不要給自己太大的壓力 遇到困難也不要逃跑 真的考不好再來說 結果還沒到我就先投降考慮重考了 不知道回家要怎麼面對他們...... 真的該坦承嗎......,,,,,,,,,,
graduate_school,壓力,/f/graduate_school/p/254276292,最近終於有題目了  但題目和我自己的系屬於完全跨領域的 大學時沒學過太多寫程式的東西 但碩班研究題目完完全全像是資工系在幹的事  網路上論文看了一堆 但也看的不是很懂 實驗室學長姐也沒人碰過這一塊...... 還一直被強調 晚同屆半年才開始做題目要快一點 （我是7月進去寒假才有題目 他們是大四寒假進去有接學長題目） 好崩潰...壓力好大...怎麼辦.......我好爛.........  現在只要吃飯時突然想到實驗室的東西就完全沒胃口吃不下飯.....,,,,,,,,,,
graduate_school,壓力,/f/graduate_school/p/254407606,考試倒數19天 沒有內耗自己去想會不會上岸的問題 也告訴自己要努力到最後🥺 但只要打開課本 就壓力大到想吐🤮 已經很努力在準備 還是會有缺漏的觀念 不知道該怎麼緩解..還是只能硬撐過去？  我還是會繼續用力的讀 希望一路走來的大家 也能熬過這段時光 讓我們成為更好的樣子,,,,,,,,,,
graduate_school,壓力,/f/graduate_school/p/238387855,#更 我不是來被譴責的吶，請理性發言( ¯•ω•¯ ) 祝福大家研究生活順利畢業  統整大家的舒壓方法 1.看劇或動畫 2.睡覺 3.縮肛30秒至一分鐘（？） 4.保持微笑 5.自慰或尻尻（！） 6.吃甜點 7.抽菸 8.喝酒 9.運動健身 10.看海 11.聽音樂 12.打鼓（沒有鼓可能可以打枕頭）  #正文 如題，很好奇大家都怎麼釋放壓力QQ  因為壓力太大，偶然發現抽菸的當下會有種輕飄飄的放鬆感覺～本來是完全不抽菸也討厭菸味的人，但現在變成每天都一定要抽才覺得放鬆⋯  最近有開始養成每週至少運動一次的習慣，偶爾也會去看展、看電影、散步之類的行程。  居然變成自己當初最討厭但樣子⋯ 抽菸BAD但暫時戒不了(⌯˃̶᷄ ﹏ ˂̶᷄⌯),,,,,,,,,,
graduate_school,壓力,/f/graduate_school/p/241153185,昨天剛考完一所，六天後還有一所 今天要翻開專業科目就覺得壓力好大 很怕看到昨天寫錯的心情就會超差 就會開始想今年又無法上岸怎麼辦 (꒦ິ⌓꒦ີ)  但看版上好多人考完可以直接討論跟對答案 怎麼大家心理素質都那麼強(৹ᵒ̴̶̷᷄́ฅᵒ̴̶̷᷅৹),,,,,,,,,,
graduate_school,壓力,/f/graduate_school/p/240653915,如題 不想考研究所了🥹,,,,,,,,,,
graduate_school,壓力,/f/graduate_school/p/237118373,最近因為推甄壓力很大 一下覺得自己有希望 聽了學長姐的經驗之後就又覺得無望了 雖然知道這樣不好 但還是會患得患失的,,,,,,,,,,
graduate_school,壓力,/f/graduate_school/p/240742072,我現在釋放壓力的手段是看統神國動的直播 這兩個人的直播是真d有料 每次看都會覺得人生沒那麼困難 我都會用統神國動的邏輯來思考事情 例如考研考不上就再考兩年 各位考研仔跟我一起加油吧,,,,,,,,,,
graduate_school,壓力,/f/graduate_school/p/239745782,四大理工碩，老闆是該系極熱門老師（就是會直接被直升推甄生預定滿的那種），因為某些原因老師願意破例收人，主要是因為大學專題做的兩個專題和新老師的領域高度相關，再加上過去實驗室有稍微合作關係，因此老闆有互相認識，不過因為同屆除了自己以外都是直升的，大部分大四推甄上之後也是持續都會去實驗室繼續做，因此都算是實驗室老油條，我雖然做的專題領域有相關但還是會有進度跟不太上其他人的挫折和壓力，不知道要怎麼克服這種覺得自己是同屆最遜的想法，想請問如果是這樣會建議乾脆回原本的實驗室直升嗎？  補充：兩邊實驗室氣氛都很好，老闆也都不錯，四大的老師要求比較紮實比較硬，但工時短；原本的實驗室老師要求其實沒有很嚴苛，但規定的工時比較長（就是可能會很早或很晚突襲實驗室會希望看到研究生都在的那種）,,,,,,,,,,
graduate_school,壓力,/f/graduate_school/p/239886622,小弟升我四年級，從6月底開始準備考研（在校成績很微妙，應該推不上想要的QQ)，有去找補習班上課，在這兩個月中，基本上每天不是補習就是在刷題目，雖然稱不上很認真，但至少我對這兩個月問心無愧  然而，以前我是躺在床上10分鐘內就能睡著的人，但暑假期間常常感覺壓力滿大的，容易想東想西，常常躺了半個小時還沒睡著， 甚至有兩三天整晚睡不著，然後隔天上課讀書超累的QQ  請問各位大大，大家都是如何調整自己的心態，還有這樣需要去看一下身心科嗎QQ~,,,,,,,,,,
graduate_school,壓力,/f/graduate_school/p/234893957,最近 推甄心得文也要開酸開戰 研究所選擇也要開戰 大家是壓力太大想要到處引戰嗎？ 還說備取開黑 如果不是備取開黑不就很冤望 備取隨便查都知道有誰 再不小心說詳細一點根本知道是誰 應該沒人這麼笨吧？ 自己不接受不同聲音還要說別人不接受不同聲音真的不行耶 到底為什麼表達自己意見的同時還要嗆跟你相反意見的人呢 完全就是故意引戰啊 樓主原本好好的一篇文都亂套了 尤其是分享文 樓主好心分享給未來要推甄的學弟妹 結果被這樣亂搞 大家以後都不敢發分享文了吧 不過已經上了的人是沒差啦 可憐的是學弟妹,,,,,,,,,,
graduate_school,壓力,/f/graduate_school/p/232590585,研究所考試剩兩個多月 大家好像都很徬徨 我也是QQQQQQ  而且最近寫考古題寫到好挫折 覺得自己寫的內容總是不如別人 數量上面也沒有達到預期的標準 壓力好大(;´༎ຶД༎ຶ`) 每天都很鬱卒 不想面對新的（繼續寫考古題的）一天  發現這樣好像不行需要重整一下心情 但平常又沒什麼休閒娛樂 來問問大家除了運動跟看電影外還會做點什麼療癒自己(⁎⁍̴̛ᴗ⁍̴̛⁎),,,,,,,,,,
graduate_school,壓力,/f/graduate_school/p/237174909,不知道發在這裡對不對，但是是跟研究所推甄心情有關的，不符合版規會自删。  先簡介一下背景，成大非電資但算熱門理工科系大四，系排約35%，成大一定可以推上，清大就算有推上也是備取非常後面（照往年經歷），所以我很早就已經找好一個不雷的教授（雖然沒錢但也沒什麼事的那種），教授也答應我了，對外也會介紹這是我之後的研究生。  但我的父母非常想要我推清大，我知道他們想要望子成龍望女成鳳的心情，但我也已經跟他們說明，如果我去清大的話選擇不會比現在更好（教授的部分），因為他們是商科的，雖然有讀到碩但是大家也知道理工碩幾乎每天都會看到老師，遇到雷教授的比例大有人在，每天被教授電的也不是沒有人，不過他們還是想要我推清大，跟我說推看看沒關係，上了也不用去讀🤔，不過我估計上了還是會叫我去讀……  不過我已經答應老師了，加上老師跟清大的關係非常緊密，我不知道如果我在榜單上的話他作何感想，就算我到時沒去清大，繼續留在老師底下做事也不知道老師皆不介意，就算他不介意我也很介意  然後我媽說一句讓我更生氣的話，如果你會介意的話那找別的教授啊………問題是誰知道教授會不會跟別的教授說我怎樣……  我真不知道該怎麼辦了，已經跟他溝通過好多次了，想要跟他好好說他每次都不聽，煩惱這件事已經讓我失眠一個禮拜了😭😭😭,,,,,,,,,,
graduate_school,壓力,/f/graduate_school/p/239595986,最近各種討論抄襲的文章、媒體空巢而出 當然學術倫理是作為學術人的至高原則 這個事件也能時時警惕大家 不過 這也讓原本就很努力的研究生備感壓力 8% 12%被各種相似度壓的喘不過氣 民間的極高的關注對於學術永續發展真的有助益？這點讓人非常質疑 另外，碩士生真的有能力原創出什麼能在學界掀起驚濤駭浪的學位論文嗎？ ,,,,,,,,,,
graduate_school,壓力,/f/graduate_school/p/234413703,月底就要送資料了... 雖然說這樣可能會有點高傲，但自認為自己的表現比班上大多人好（因為更強的都去國外了） 但我通適跟體育成績太差了..讓我自己班排掉到很後面（有一學期通適跟體育都剛好60） 在學期間協助教授很多專案，也曾經寫投過科技部的論文計畫書，但因為在校成績也沒有過，請問這樣推四大還有救嗎？  好啦，其實自己也只是壓力大來這邊請教一下，我該怎麼調適心情呢？,,,,,,,,,,
